{
  "schema_version": 1,
  "kind": "ORCHESTRATOR_METRICS_PROGRESS",
  "generation_digest": "aaaaaaaaaaaaaaaaaaaaaaaaaaaaaaaaaaaaaaaaaaaaaaaaaaaaaaaaaaaaaaaa",
  "registry_digest": "bbbbbbbbbbbbbbbbbbbbbbbbbbbbbbbbbbbbbbbbbbbbbbbbbbbbbbbbbbbbbbbb",
  "evaluation_time": "2026-09-08T10:00:00Z",
  "registry_project_uuid": "11111111-1111-4111-8111-111111111111",
  "module_id": null,
  "minimum_forecast_samples": 5,
  "authority": "advisory_only",
  "status": "partial",
  "reason": "baseline_scope_unavailable",
  "baseline_revision": null,
  "current_revision": "scope-2",
  "baseline": null,
  "current": {
    "item_count": 1,
    "accepted_count": 0,
    "progress_percent": 0
  },
  "scope_change": null,
  "modules": [],
  "forecast": {
    "status": "unavailable",
    "reason": "insufficient_comparable_history"
  },
  "details": {}
}
